### ISSUE TITLE
[General] DNS Server redirecting to LocalAddress for external clients in Dolphin

### ISSUE THREAD

**Issue by Matt-Swift** [fuzziqersoftware/newserv#100]
EDIT: This was an issue originally with half-done Wireshark logs for an individual unable to connect, but I got the full logs and figured out the issue for the individual unable to connect.
---
For some individuals connecting externally, the DNS server is redirecting players to the LocalAddress parameter instead of the ExternalAddress parameter in the config file. This is in Dolphin.

Please find below some Wireshark logs of a player that was unable to connect (Windows 11):

```
10193    8.316016    192.168.0.10    217.160.146.96    DNS    86    Standard query 0x0000 A gc01.st-pso.games.sega.net
10330    8.433824    217.160.146.96    192.168.0.10    DNS    102    Standard query response 0x0000 A gc01.st-pso.games.sega.net A 127.0.0.1
```

Please find below some Wireshark logs of a player who was able to connect:

```
3977	3.743853646	192.168.1.117	217.160.146.96	DNS	86	Standard query 0x0000 A gc01.st-pso.games.sega.net
3988	3.756903901	217.160.146.96	192.168.1.117	DNS	102	Standard query response 0x0000 A gc01.st-pso.games.sega.net A 217.160.146.96
3993	3.765266953	192.168.1.117	217.160.146.96	TCP	74	33856 → 9103 [SYN] Seq=0 Win=64240 Len=0 MSS=1460 SACK_PERM TSval=506456842 TSecr=0 WS=128
3997	3.778151056	217.160.146.96	192.168.1.117	TCP	74	9103 → 33856 [SYN, ACK] Seq=0 Ack=1 Win=65160 Len=0 MSS=1452 SACK_PERM TSval=4240254835 TSecr=506456842 WS=128
3998	3.778180160	192.168.1.117	217.160.146.96	TCP	66	33856 → 9103 [ACK] Seq=1 Ack=1 Win=64256 Len=0 TSval=506456855 TSecr=4240254835
4007	3.792141032	217.160.146.96	192.168.1.117	TCP	322	9103 → 33856 [PSH, ACK] Seq=1 Ack=1 Win=65280 Len=256 TSval=4240254849 TSecr=506456855
4008	3.792162562	192.168.1.117	217.160.146.96	TCP	66	33856 → 9103 [ACK] Seq=1 Ack=257 Win=64128 Len=0 TSval=506456869 TSecr=4240254849
4071	3.916571224	192.168.1.117	217.160.146.96	TCP	290	33856 → 9103 [PSH, ACK] Seq=1 Ack=257 Win=64128 Len=224 TSval=506456994 TSecr=4240254849
4083	3.929144956	217.160.146.96	192.168.1.117	TCP	66	9103 → 33856 [ACK] Seq=257 Ack=225 Win=65152 Len=0 TSval=4240254986 TSecr=506456994
4084	3.930340476	217.160.146.96	192.168.1.117	TCP	70	9103 → 33856 [PSH, ACK] Seq=257 Ack=225 Win=65152 Len=4 TSval=4240254987 TSecr=506456994
4085	3.930367557	192.168.1.117	217.160.146.96	TCP	66	33856 → 9103 [ACK] Seq=225 Ack=261 Win=64128 Len=0 TSval=506457008 TSecr=4240254987
4094	3.948576058	192.168.1.117	217.160.146.96	TCP	402	33856 → 9103 [PSH, ACK] Seq=225 Ack=261 Win=64128 Len=336 TSval=506457026 TSecr=4240254987
4101	3.967138853	217.160.146.96	192.168.1.117	TCP	318	9103 → 33856 [PSH, ACK] Seq=261 Ack=561 Win=64896 Len=252 TSval=4240255024 TSecr=506457026
4102	3.979359273	192.168.1.117	217.160.146.96	TCP	78	33856 → 9103 [PSH, ACK] Seq=561 Ack=513 Win=64128 Len=12 TSval=506457057 TSecr=4240255024
4103	3.979445094	192.168.1.117	217.160.146.96	TCP	1506	33856 → 9103 [ACK] Seq=573 Ack=513 Win=64128 Len=1440 TSval=506457057 TSecr=4240255024
4104	3.979447248	192.168.1.117	217.160.146.96	TCP	86	33856 → 9103 [PSH, ACK] Seq=2013 Ack=513 Win=64128 Len=20 TSval=506457057 TSecr=4240255024
4105	3.979534110	192.168.1.117	217.160.146.96	TCP	1506	33856 → 9103 [ACK] Seq=2033 Ack=513 Win=64128 Len=1440 TSval=506457057 TSecr=4240255024
4106	3.979536655	192.168.1.117	217.160.146.96	TCP	86	33856 → 9103 [PSH, ACK] Seq=3473 Ack=513 Win=64128 Len=20 TSval=506457057 TSecr=4240255024
4107	3.979832740	192.168.1.117	217.160.146.96	TCP	1506	33856 → 9103 [ACK] Seq=3493 Ack=513 Win=64128 Len=1440 TSval=506457057 TSecr=4240255024
4108	3.979835625	192.168.1.117	217.160.146.96	TCP	86	33856 → 9103 [PSH, ACK] Seq=4933 Ack=513 Win=64128 Len=20 TSval=506457057 TSecr=4240255024
4109	3.979890408	192.168.1.117	217.160.146.96	TCP	1506	33856 → 9103 [ACK] Seq=4953 Ack=513 Win=64128 Len=1440 TSval=506457057 TSecr=4240255024
4110	3.979892151	192.168.1.117	217.160.146.96	TCP	86	33856 → 9103 [PSH, ACK] Seq=6393 Ack=513 Win=64128 Len=20 TSval=506457057 TSecr=4240255024
4111	3.979941504	192.168.1.117	217.160.146.96	TCP	1506	33856 → 9103 [ACK] Seq=6413 Ack=513 Win=64128 Len=1440 TSval=506457057 TSecr=4240255024
4123	3.992639549	217.160.146.96	192.168.1.117	TCP	94	9103 → 33856 [PSH, ACK] Seq=513 Ack=2033 Win=63488 Len=28 TSval=4240255050 TSecr=506457057
4124	3.992671098	192.168.1.117	217.160.146.96	TCP	1506	33856 → 9103 [ACK] Seq=7853 Ack=541 Win=64128 Len=1440 TSval=506457070 TSecr=4240255050
4125	3.992676017	192.168.1.117	217.160.146.96	TCP	1506	33856 → 9103 [PSH, ACK] Seq=9293 Ack=541 Win=64128 Len=1440 TSval=506457070 TSecr=4240255050
4126	3.992712135	192.168.1.117	217.160.146.96	TCP	782	33856 → 9103 [PSH, ACK] Seq=10733 Ack=541 Win=64128 Len=716 TSval=506457070 TSecr=4240255050
4127	3.993104520	217.160.146.96	192.168.1.117	TCP	66	9103 → 33856 [ACK] Seq=541 Ack=3493 Win=63616 Len=0 TSval=4240255050 TSecr=506457057
4128	3.993862661	217.160.146.96	192.168.1.117	TCP	66	9103 → 33856 [ACK] Seq=541 Ack=4953 Win=64128 Len=0 TSval=4240255051 TSecr=506457057
4129	3.994866141	217.160.146.96	192.168.1.117	TCP	66	9103 → 33856 [ACK] Seq=541 Ack=6413 Win=64128 Len=0 TSval=4240255052 TSecr=506457057
4131	4.005329068	217.160.146.96	192.168.1.117	TCP	66	9103 → 33856 [ACK] Seq=541 Ack=9293 Win=64128 Len=0 TSval=4240255062 TSecr=506457057
4132	4.006022327	217.160.146.96	192.168.1.117	TCP	66	9103 → 33856 [ACK] Seq=541 Ack=11449 Win=64128 Len=0 TSval=4240255063 TSecr=506457070
4142	4.017226633	192.168.1.117	217.160.146.96	TCP	70	33856 → 9103 [PSH, ACK] Seq=11449 Ack=541 Win=64128 Len=4 TSval=506457094 TSecr=4240255063
4174	4.074523903	217.160.146.96	192.168.1.117	TCP	66	9103 → 33856 [ACK] Seq=541 Ack=11453 Win=64128 Len=0 TSval=4240255132 TSecr=506457094
4335	4.323289989	217.160.146.96	192.168.1.117	TCP	1506	9103 → 33856 [ACK] Seq=541 Ack=11453 Win=64128 Len=1440 TSval=4240255380 TSecr=506457094
4336	4.323635006	217.160.146.96	192.168.1.117	TCP	1506	9103 → 33856 [PSH, ACK] Seq=1981 Ack=11453 Win=64128 Len=1440 TSval=4240255380 TSecr=506457094
4337	4.323800846	217.160.146.96	192.168.1.117	TCP	1506	9103 → 33856 [ACK] Seq=3421 Ack=11453 Win=64128 Len=1440 TSval=4240255380 TSecr=506457094
4338	4.323901615	192.168.1.117	217.160.146.96	TCP	66	33856 → 9103 [ACK] Seq=11453 Ack=4861 Win=62336 Len=0 TSval=506457401 TSecr=4240255380
4339	4.324052428	217.160.146.96	192.168.1.117	TCP	1506	9103 → 33856 [PSH, ACK] Seq=4861 Ack=11453 Win=64128 Len=1440 TSval=4240255380 TSecr=506457094
4340	4.324295764	217.160.146.96	192.168.1.117	TCP	1506	9103 → 33856 [ACK] Seq=6301 Ack=11453 Win=64128 Len=1440 TSval=4240255380 TSecr=506457094
4341	4.324544430	217.160.146.96	192.168.1.117	TCP	1506	9103 → 33856 [PSH, ACK] Seq=7741 Ack=11453 Win=64128 Len=1440 TSval=4240255380 TSecr=506457094
4342	4.324556933	217.160.146.96	192.168.1.117	TCP	1506	9103 → 33856 [ACK] Seq=9181 Ack=11453 Win=64128 Len=1440 TSval=4240255380 TSecr=506457094
4343	4.324805819	217.160.146.96	192.168.1.117	TCP	1506	9103 → 33856 [PSH, ACK] Seq=10621 Ack=11453 Win=64128 Len=1440 TSval=4240255380 TSecr=506457094
4344	4.324821479	217.160.146.96	192.168.1.117	TCP	1506	9103 → 33856 [ACK] Seq=12061 Ack=11453 Win=64128 Len=1440 TSval=4240255380 TSecr=506457094
4345	4.325019129	192.168.1.117	217.160.146.96	TCP	66	33856 → 9103 [ACK] Seq=11453 Ack=13501 Win=55808 Len=0 TSval=506457402 TSecr=4240255380
4346	4.325050758	217.160.146.96	192.168.1.117	TCP	1506	9103 → 33856 [PSH, ACK] Seq=13501 Ack=11453 Win=64128 Len=1440 TSval=4240255380 TSecr=506457094
4355	4.336572620	217.160.146.96	192.168.1.117	TCP	1506	9103 → 33856 [ACK] Seq=14941 Ack=11453 Win=64128 Len=1440 TSval=4240255393 TSecr=506457401
4356	4.336587568	192.168.1.117	217.160.146.96	TCP	66	33856 → 9103 [ACK] Seq=11453 Ack=16381 Win=56832 Len=0 TSval=506457414 TSecr=4240255380
4357	4.336819382	217.160.146.96	192.168.1.117	TCP	1506	9103 → 33856 [PSH, ACK] Seq=16381 Ack=11453 Win=64128 Len=1440 TSval=4240255393 TSecr=506457401
4358	4.337045376	217.160.146.96	192.168.1.117	TCP	1506	9103 → 33856 [ACK] Seq=17821 Ack=11453 Win=64128 Len=1440 TSval=4240255393 TSecr=506457401
4359	4.337290495	217.160.146.96	192.168.1.117	TCP	1506	9103 → 33856 [PSH, ACK] Seq=19261 Ack=11453 Win=64128 Len=1440 TSval=4240255393 TSecr=506457401
4360	4.337302537	217.160.146.96	192.168.1.117	TCP	1506	9103 → 33856 [ACK] Seq=20701 Ack=11453 Win=64128 Len=1440 TSval=4240255393 TSecr=506457401
4361	4.337314830	217.160.146.96	192.168.1.117	TCP	1506	9103 → 33856 [PSH, ACK] Seq=22141 Ack=11453 Win=64128 Len=1440 TSval=4240255393 TSecr=506457401
4362	4.337548378	217.160.146.96	192.168.1.117	TCP	1506	9103 → 33856 [ACK] Seq=23581 Ack=11453 Win=64128 Len=1440 TSval=4240255394 TSecr=506457402
4363	4.337799519	217.160.146.96	192.168.1.117	TCP	1506	9103 → 33856 [PSH, ACK] Seq=25021 Ack=11453 Win=64128 Len=1440 TSval=4240255394 TSecr=506457402
4364	4.337998692	192.168.1.117	217.160.146.96	TCP	66	33856 → 9103 [ACK] Seq=11453 Ack=26461 Win=50304 Len=0 TSval=506457415 TSecr=4240255393
4365	4.338047543	217.160.146.96	192.168.1.117	TCP	1506	9103 → 33856 [ACK] Seq=26461 Ack=11453 Win=64128 Len=1440 TSval=4240255394 TSecr=506457402
4366	4.338295428	217.160.146.96	192.168.1.117	TCP	1506	9103 → 33856 [PSH, ACK] Seq=27901 Ack=11453 Win=64128 Len=1440 TSval=4240255394 TSecr=506457402
4367	4.338543252	217.160.146.96	192.168.1.117	TCP	1506	9103 → 33856 [ACK] Seq=29341 Ack=11453 Win=64128 Len=1440 TSval=4240255394 TSecr=506457402
4368	4.338555435	217.160.146.96	192.168.1.117	TCP	1254	9103 → 33856 [PSH, ACK] Seq=30781 Ack=11453 Win=64128 Len=1188 TSval=4240255394 TSecr=506457402
4370	4.339080489	192.168.1.117	217.160.146.96	TCP	66	33856 → 9103 [ACK] Seq=11453 Ack=31969 Win=46080 Len=0 TSval=506457416 TSecr=4240255394
4463	4.485091421	192.168.1.117	217.160.146.96	TCP	70	33856 → 9103 [PSH, ACK] Seq=11453 Ack=31969 Win=64128 Len=4 TSval=506457562 TSecr=4240255394
4468	4.497532715	217.160.146.96	192.168.1.117	TCP	66	9103 → 33856 [ACK] Seq=31969 Ack=11457 Win=64128 Len=0 TSval=4240255555 TSecr=506457562
```

ExternalAddress is 217.160.146.96, LocalAddress is 127.0.0.1.

This could be a user issue rather than the something the server does. I was able to get around this by setting the LocalAddress as the same as the ExternalAddress (no clients will be connecting locally anyway).

**Comment by fuzziqersoftware** [comment]
Can you get more information about this case? What was the first byte of their IP address? Which router, which ISP, and what type of internet connection do they have? According to the code, redirecting a client to their own external address should be impossible; I suspect their router or ISP might be doing some shenanigans.

**Comment by fuzziqersoftware** [comment]
I believe we've figured out that this is due to DNS infrastructure modernizing since the time PSO was built, which isn't something that we can fix in newserv's DNS server, unfortunately. Please reopen if this is incorrect.
